{
  "calibration": {
    "confidence_penalty": 0.15,
    "reason": "Sample-size and realized-outcome linkage are incomplete.",
    "status": "proxy_only"
  },
  "diagnostics": {
    "candidate_count": 1,
    "expectancy_proxy": 0.608,
    "mode": "proxy_from_scanner_handoff",
    "sample_size_bucket": "small",
    "score_stats": {
      "max": 80.4,
      "mean": 80.4,
      "median": 80.4,
      "min": 80.4,
      "std": 0.0
    },
    "weak_candidate_ratio": 0.0
  },
  "produced_at": "2026-03-30T13:02:56.268386+00:00",
  "regime_sensitivity": {
    "note": "Real regime-aware backtest is not wired in this bridge stage.",
    "required_next_source": "backtest_framework.py outputs",
    "status": "unknown"
  },
  "run_context": {
    "as_of_date": "2026-03-30",
    "code_version": "bridge-v1",
    "created_at": "2026-03-30T13:02:56.267671+00:00",
    "market": "US",
    "model_version": "legacy",
    "run_id": "RUN-049DBBA2",
    "strategy_version": "bridge-smoke-v10"
  },
  "warnings": [
    {
      "code": "PROXY_BACKTEST_ONLY",
      "message": "Backtest handoff is proxy-only in this stage; connect real diagnostics next.",
      "severity": "warning"
    },
    {
      "code": "SMALL_SAMPLE",
      "message": "Sample size is small (1 candidates).",
      "severity": "warning"
    }
  ]
}